QGS1:			towards a better understanding of context and context-awareness	
				towards context-awareness in ubiquitous computing	

QGS2:			tag-based user modeling for social multi-device adaptive guides	
				tag-based user modeling for social multi-device adaptive guides	

QGS3:			consistent modelling of users, devices and sensors in a ubiquitous computing environment	
				modelling users, context and devices for adaptive user interface systems	

QGS4:			exploring issues of user model transparency and proactive behaviour in an office environment control system	
				middleware support for transparency and user control in context-aware systems	

QGS5:			a conceptual framework and a toolkit for supporting the rapid prototyping of context-aware applications	
				amarino: a toolkit for the rapid prototyping of mobile ubiquitous computing	

QGS6:			toward an osgi-based infrastructure for context-aware applications	
				toward an agent-based pluggable infrastructure for context-awareness	

QGS7:			ontology-based user modeling in an augmented audio reality system for museums	
				the integration of augmented reality and the concept of sticker album collection for informal learning in museums	

QGS8:			an infrastructure approach to context-aware computing	
				context-aware service infrastructure	

QGS9:			assessment of user affective and belief states for interface adaptation: application to an air force pilot task	
				an mde approach for user interface adaptation to the context of use	

QGS10:			an adaptive middleware framework for context-aware applications	
				an adaptive middleware framework for context-aware applications	

QGS11:			managing context information in mobile devices	
				context-aware information in mobile devices	

QGS12:			user-centred design of flexible hypermedia for a mobile guide: reflections on the hyperaudio experience	
				towards human-centred design	

QGS13:			contextphone: a prototyping platform for context-aware mobile applications	
				prototyping a context-aware framework for pervasive entertainment applications	

QGS14:			cosar: hybrid reasoning for context-aware activity recognition	
				context-aware hybrid reasoning framework for pervasive healthcare	

QGS15:			a middleware infrastructure for active spaces	
				authoring social-aware tasks on active spaces	

QGS16:			advanced interaction in context	
				context-aware provision of advanced internet services	

QGS17:			adaptive, intelligent presentation of information for the museum visitor in peach	
				the research on applying rfid information system architecture for museum service	

