QGS1:			A pilot study using machine learning and domain knowledge to facilitate comparative effectiveness review updating	
				The impact of machine learning techniques in the study of bipolar disorder: A systematic review	

QGS2:			A comparison of automated training-by-example selection algorithms for Evidence Based Software Engineering	
				Evidence synthesis software	

QGS3:			A method to support search string building in systematic literature reviews through visual text mining	
				Using visual text mining to support the study selection activity in systematic literature reviews	

QGS4:			A new algorithm for reducing the workload of experts in performing systematic reviews	
				Reducing systematic review workload through certainty-based screening	

QGS5:			A new iterative method to reduce workload in systematic review process	
				Modeling annotation time to reduce workload in comparative effectiveness reviews	

QGS6:			A text-mining framework for supporting systematic reviews	
				SparkText: Biomedical text mining on big data framework	

QGS7:			A prospective evaluation of an automated classification system to support evidence-based medicine and systematic review	
				Automatic text classification to support systematic reviews in medicine	

QGS8:			A visual analysis approach to update systematic reviews	
				A visual analysis approach to validate the selection review of primary studies in systematic reviews	

QGS9:			A visual analysis approach to validate the selection review of primary studies in systematic reviews	
				A visual analysis approach to validate the selection review of primary studies in systematic reviews	

QGS10:			A visual text mining approach for systematic reviews	
				Using visual text mining to support the study selection activity in systematic literature reviews	

QGS11:			An approach based on visual text mining to support categorization and classification in the systematic mapping	
				A systematic mapping on the use of visual data mining to support the conduct of systematic literature reviews	

QGS12:			An extension of the systematic literature review process with visual text mining: a case study on software engineering	
				Using visual text mining to support the study selection activity in systematic literature reviews	

QGS13:			An svm-based high-quality article classifier for systematic reviews	
				An SVM-based high-quality article classifier for systematic reviews	

QGS14:			Active learning for biomedical citation screening	
				Active learning for the automation of medical systematic review creation	

QGS15:			Automatic text classification to support systematic reviews in medicine	
				Automatic text classification to support systematic reviews in medicine	

QGS16:			Automatically locating results to support systematic reviews in software engineering	
				Tools to support systematic literature reviews in software engineering: A mapping study	

QGS17:			Building systematic reviews using automatic text classification techniques	
				Automatic text classification to support systematic reviews in medicine	

QGS18:			Classifying biomedical abstracts using committees of classifiers and collective ranking techniques	
				Using rule-based classifiers in systematic reviews: A semantic class association rules approach	

QGS19:			Cross-topic learning for work prioritization in systematic review creation and update	
				Cross-Topic Learning for Work Prioritization in Systematic Review Creation and Update	

QGS20:			DASyR(IR) – document analysis system for systematic reviews (in information retrieval)	
				How well do physicians use electronic information retrieval systems?: A framework for investigation and systematic review	

QGS21:			Deploying an interactive machine learning system in an evidence-based practice center: abstrackr	
				Agency for Healthcare Research and Quality Evidence-based Practice Center methods provide guidance on prioritization and selection of harms in systematic reviews	

QGS22:			Exploiting the systematic review protocol for classification of medical abstracts	
				Exploiting the systematic review protocol for classification of medical abstracts	

QGS23:			Facilitating biomedical systematic reviews using ranked text retrieval and classification	
				SYRIAC: The systematic review information automated collection system a data warehouse for facilitating automated biomedical text classification.	

QGS24:			Feature engineering and a proposed decision-support system for systematic reviewers of medical evidence	
				Tools to support systematic literature reviews in software engineering: A mapping study	

QGS25:			Finding better active learners for faster literature reviews	
				Active learning for the automation of medical systematic review creation	

QGS26:			Improving the performance of text categorization models used for the selection of high quality articles	
				Improving the performance of text categorization models used for the selection of high quality articles	

QGS27:			Linked data approach for selection process automation in systematic reviews	
				Linked data approach for selection process automation in systematic reviews	

QGS28:			Machine learning techniques for the automation of literature reviews and systematic reviews in EFSA	
				Machine learning and microsimulation techniques on the prognosis of dementia: A systematic literature review	

QGS29:			Machine learning to assist risk-of-bias assessments in systematic reviews	
				Machine learning to assist risk-of-bias assessments in systematic reviews	

QGS30:			Modeling annotation time to reduce workload in comparative effectiveness reviews	
				Modeling annotation time to reduce workload in comparative effectiveness reviews	

QGS31:			Optimizing feature representation for automated systematic review work prioritization	
				Cross-Topic Learning for Work Prioritization in Systematic Review Creation and Update	

QGS32:			Pinpointing needles in giant haystacks: use of text mining to reduce impractical screening workload in extremely large scoping reviews	
				A critical analysis of studies that address the use of text mining for citation screening in systematic reviews	

QGS33:			Reducing systematic review workload through certainty-based screening	
				Reducing systematic review workload through certainty-based screening	

QGS34:			Reducing workload in systematic review preparation using automated citation classification	
				Reducing systematic review workload through certainty-based screening	

QGS35:			Screening nonrandomized studies for medical systematic reviews: a comparative study of classifiers	
				Screening nonrandomized studies for medical systematic reviews: A comparative study of classifiers	

QGS36:			Semi-automated screening of biomedical citations for systematic reviews	
				Semi-automated screening of biomedical citations for systematic reviews	

QGS37:			Studying the potential impact of automated document classification on scheduling a systematic review update	
				Evaluation of a rule-based method for epidemiological document classification towards the automation of systematic reviews	

QGS38:			Supporting study selection of systematic literature reviews in software engineering with text mining	
				Using visual text mining to support the study selection activity in systematic literature reviews	

QGS39:			Supporting systematic reviews using text mining	
				Using visual text mining to support the study selection activity in systematic literature reviews	

QGS40:			Text categorization models for high-quality article retrieval in internal medicine	
				Improving the performance of text categorization models used for the selection of high quality articles	

QGS41:			The use of visual text mining to support the study selection activity in systematic literature reviews: a replication study	
				The use of visual text mining to support the study selection activity in systematic literature reviews: A replication study	

QGS42:			Toward modernizing the systematic review pipeline in genetics: efficient updating via data mining	
				Toward modernizing the systematic review pipeline in genetics: Efficient updating via data mining	

QGS43:			Towards automating the initial screening phase of a systematic review	
				Scandinavian guidelines for initial management of minor and moderate head trauma in children	

QGS44:			Using classifier performance visualization to improve collective ranking techniques for biomedical abstracts classification	
				Exploiting the systematic review protocol for classification of medical abstracts	

QGS45:			Using visual text mining to support the study selection activity in systematic literature reviews	
				Using visual text mining to support the study selection activity in systematic literature reviews	

QGS46:			Clustering of medical publications for evidence based medicine summarisation	
				'Clustering' documents automatically to support scoping reviews of research: a case study	

QGS47:			Combining relevancy and methodological quality into a single ranking for evidence-based medicine	
				Evaluation of the methodological quality of systematic reviews of health status measurement instruments	

QGS48:			GAPscreener: an automatic tool for screening human genetic association literature in PubMed using the support vector machine technique	
				Automatic text classification to support systematic reviews in medicine	

QGS49:			Parameterized contrast in second order soft co-occurrences: a novel text representation technique in text mining and knowledge extraction	
				Parameterized contrast in second order soft co-occurrences: A novel text representation technique in text mining and knowledge extraction	

QGS50:			Text classification on imbalanced data: application to systematic reviews automation	
				Linked data approach for selection process automation in systematic reviews	

QGS51:			Using information visualization and text mining to facilitate the conduction of systematic literature reviews	
				Using visual text mining to support the study selection activity in systematic literature reviews	

QGS52:			Using the scas strategy to perform the initial selection of studies in systematic reviews: an experimental study	
				Using visual text mining to support the study selection activity in systematic literature reviews	

